{
  "$schema": "../schemas/selection-ui-v1.schema.json",
  "schemaVersion": 1,
  "page": {
    "backgroundColor": "#071E1D",
    "headerColor": "#FFFFFF",
    "subtitleColor": "#A7B8BA",
    "backButtonColor": "#425A3D",
    "cardCornerRadius": 16
  },
  "palettes": {
    "blue":   {"backgroundColor":"#102B3B","gradientStartColor":"#0A2230","gradientEndColor":"#12394E","borderColor":"#327DA2","accentColor":"#7DDCFF","foregroundColor":"#FFFFFF","subtitleColor":"#B8CAD2","iconBrightness":1.9},
    "cyan":   {"backgroundColor":"#10343A","gradientStartColor":"#082B31","gradientEndColor":"#0C4149","borderColor":"#348A93","accentColor":"#79F0F5","foregroundColor":"#FFFFFF","subtitleColor":"#BAD6D9","iconBrightness":1.9},
    "green":  {"backgroundColor":"#123A2C","gradientStartColor":"#0B2B21","gradientEndColor":"#174936","borderColor":"#3A8B68","accentColor":"#75F2AD","foregroundColor":"#FFFFFF","subtitleColor":"#B9D5C6","iconBrightness":1.9},
    "violet": {"backgroundColor":"#261F49","gradientStartColor":"#1C1738","gradientEndColor":"#31275C","borderColor":"#6553A8","accentColor":"#BEA8FF","foregroundColor":"#FFFFFF","subtitleColor":"#CBC2E5","iconBrightness":1.95},
    "orange": {"backgroundColor":"#3C281B","gradientStartColor":"#302116","gradientEndColor":"#4B3020","borderColor":"#9B6139","accentColor":"#FFB67F","foregroundColor":"#FFFFFF","subtitleColor":"#DAC6B8","iconBrightness":1.9},
    "red":    {"backgroundColor":"#3C2025","gradientStartColor":"#321A1F","gradientEndColor":"#49232A","borderColor":"#984553","accentColor":"#FF8A99","foregroundColor":"#FFFFFF","subtitleColor":"#DEC0C5","iconBrightness":1.9},
    "gold":   {"backgroundColor":"#3A3418","gradientStartColor":"#2E2914","gradientEndColor":"#49401A","borderColor":"#98832F","accentColor":"#FFE47A","foregroundColor":"#FFFFFF","subtitleColor":"#DCD5B4","iconBrightness":1.9},
    "pink":   {"backgroundColor":"#3A1D31","gradientStartColor":"#30192A","gradientEndColor":"#49213D","borderColor":"#91436E","accentColor":"#FF91C5","foregroundColor":"#FFFFFF","subtitleColor":"#DCC0CF","iconBrightness":1.9},
    "gray":   {"backgroundColor":"#253236","gradientStartColor":"#1B272A","gradientEndColor":"#314247","borderColor":"#596C72","accentColor":"#E3ECEE","foregroundColor":"#FFFFFF","subtitleColor":"#C0CBCE","iconBrightness":1.85}
  },
  "connectionTypes": [
    {"id":"wifi","palette":"blue","icon":"images/actions/action_wifi.svg","titleKey":"connection.wifi.title","subtitleKey":"connection.wifi.subtitle"},
    {"id":"infrared","palette":"violet","icon":"images/device-types/device_ir_transceiver.svg","titleKey":"connection.infrared.title","subtitleKey":"connection.infrared.subtitle"},
    {"id":"bluetooth","palette":"green","icon":"images/device-types/device_bluetooth.svg","titleKey":"connection.bluetooth.title","subtitleKey":"connection.bluetooth.subtitle"},
    {"id":"integrations","palette":"blue","icon":"images/integrations/integration_generic.svg","titleKey":"connection.integrations.title","subtitleKey":"connection.integrations.subtitle"},
    {"id":"other","palette":"gray","icon":"images/device-types/device_general.svg","titleKey":"connection.other.title","subtitleKey":"connection.other.subtitle"}
  ],
  "deviceTypes": {
    "television":{"id":"television","palette":"blue","icon":"images/device-types/device_television.svg","subtitleKey":"device.television.subtitle"},
    "air-conditioner":{"id":"air-conditioner","palette":"cyan","icon":"images/device-types/device_air_conditioner.svg","subtitleKey":"device.airConditioner.subtitle"},
    "fan":{"id":"fan","palette":"green","icon":"images/device-types/device_fan.svg","subtitleKey":"device.fan.subtitle"},
    "av-receiver":{"id":"av-receiver","palette":"orange","icon":"images/device-types/device_av_receiver.svg","subtitleKey":"device.avReceiver.subtitle"},
    "set-top-box":{"id":"set-top-box","palette":"green","icon":"images/device-types/device_set_top_box.svg","subtitleKey":"device.setTopBox.subtitle"},
    "car-multimedia":{"id":"car-multimedia","palette":"red","icon":"images/device-types/device_car_multimedia.svg","subtitleKey":"device.carMultimedia.subtitle"},
    "projector":{"id":"projector","palette":"violet","icon":"images/device-types/device_projector.svg","subtitleKey":"device.projector.subtitle"},
    "bidet":{"id":"bidet","palette":"cyan","icon":"images/device-types/device_bidet.svg","subtitleKey":"device.bidet.subtitle"},
    "blu-ray-player":{"id":"blu-ray-player","palette":"violet","icon":"images/device-types/device_blu_ray_player.svg","subtitleKey":"device.player.subtitle"},
    "dvd-player":{"id":"dvd-player","palette":"violet","icon":"images/device-types/device_dvd_player.svg","subtitleKey":"device.player.subtitle"},
    "streaming-device":{"id":"streaming-device","palette":"violet","icon":"images/device-types/device_streaming_device.svg","subtitleKey":"device.media.subtitle"},
    "light":{"id":"light","palette":"gold","icon":"images/device-types/device_light.svg","subtitleKey":"device.light.subtitle"},
    "camera":{"id":"camera","palette":"pink","icon":"images/device-types/device_camera.svg","subtitleKey":"device.camera.subtitle"},
    "cameras":{"id":"cameras","palette":"pink","icon":"images/device-types/device_camera.svg","subtitleKey":"device.camera.subtitle"},
    "computers":{"id":"computers","palette":"blue","icon":"images/device-types/device_computer.svg","subtitleKey":"device.computer.subtitle"},
    "computer":{"id":"computer","palette":"blue","icon":"images/device-types/device_computer.svg","subtitleKey":"device.computer.subtitle"},
    "sensor":{"id":"sensor","palette":"cyan","icon":"images/device-types/device_sensor.svg","subtitleKey":"device.sensor.subtitle"},
    "temperature":{"id":"temperature","palette":"cyan","icon":"images/device-types/device_temperature.svg","subtitleKey":"device.sensor.subtitle"},
    "switch":{"id":"switch","palette":"green","icon":"images/device-types/device_switch.svg","subtitleKey":"device.switch.subtitle"},
    "general":{"id":"general","palette":"gray","icon":"images/device-types/device_general.svg","subtitleKey":"device.generic.subtitle"}
  },
  "specialItems": {
    "bluetooth-search":{"id":"bluetooth-search","palette":"green","icon":"images/device-types/device_bluetooth.svg","titleKey":"special.bluetoothSearch.title","subtitleKey":"special.bluetoothSearch.subtitle"},
    "bluetooth-hid":{"id":"bluetooth-hid","palette":"violet","icon":"images/device-types/device_bluetooth.svg","titleKey":"special.bluetoothHid.title","subtitleKey":"special.bluetoothHid.subtitle"},
    "hubitat":{"id":"hubitat","palette":"violet","icon":"images/integrations/integration_hubitat.svg","titleKey":"special.hubitat.title","subtitleKey":"special.hubitat.subtitle"},
    "philips-hue":{"id":"philips-hue","palette":"cyan","icon":"images/integrations/integration_philips_hue.svg","titleKey":"special.hue.title","subtitleKey":"special.hue.subtitle"},
    "computer":{"id":"computer","palette":"blue","icon":"images/device-types/device_computer.svg","titleKey":"special.computer.title","subtitleKey":"special.computer.subtitle"},
    "google-home":{"id":"google-home","palette":"green","icon":"images/integrations/integration_google_home.svg","titleKey":"special.googleHome.title","subtitleKey":"special.googleHome.subtitle"},
    "matter":{"id":"matter","palette":"violet","icon":"images/integrations/integration_matter.svg","titleKey":"","subtitleKey":""},
    "mqtt":{"id":"mqtt","palette":"blue","icon":"images/integrations/integration_mqtt.svg","titleKey":"","subtitleKey":""},
    "home-assistant":{"id":"home-assistant","palette":"cyan","icon":"images/integrations/integration_home_assistant.svg","titleKey":"","subtitleKey":""},
    "shelly":{"id":"shelly","palette":"green","icon":"images/integrations/integration_shelly.svg","titleKey":"","subtitleKey":""},
    "android-tv":{"id":"android-tv","palette":"blue","icon":"images/integrations/integration_android_tv.svg","titleKey":"","subtitleKey":""},
    "dashboard":{"id":"dashboard","palette":"blue","icon":"images/device-types/device_dashboard.svg","titleKey":"special.dashboard.title","subtitleKey":"special.dashboard.subtitle"},
    "folder":{"id":"folder","palette":"gold","icon":"images/device-types/device_folder.svg","titleKey":"special.folder.title","subtitleKey":"special.folder.subtitle"}
  },
  "manufacturerPalettes": {
    "Samsung":"blue","LG":"pink","Sony":"blue","Philips":"blue","Panasonic":"blue","Toshiba":"red","Hisense":"cyan","Sharp":"red","Gree":"cyan","Daikin":"cyan","Mitsubishi":"red","Fujitsu":"red"
  }
}
